{
  "$schema": "http://json-schema.org/draft-07/schema#",
  "title": "Drill",
  "description": "Metadata for a single drill generator. The actual generation logic lives in backend/app/drills/*.py -- this file is display/config metadata, not the generator itself.",
  "type": "object",
  "required": ["id", "name", "category", "implemented"],
  "properties": {
    "id": {
      "type": "string",
      "description": "Must match a Drill.id in backend/app/drills/registry.py"
    },
    "name": {
      "type": "string",
      "description": "Human-readable display name, e.g. 'Addition'"
    },
    "category": {
      "type": "string",
      "enum": ["arithmetic", "algebra", "trigonometry", "calculus", "linear-algebra", "differential-equations"]
    },
    "description": {
      "type": "string"
    },
    "difficulty_notes": {
      "type": "string",
      "description": "Human-readable explanation of what difficulty 0.0 vs 1.0 looks like for this drill"
    },
    "implemented": {
      "type": "boolean",
      "description": "Whether backend/app/drills/*.py actually has a working generator for this yet"
    },
    "prerequisites": {
      "type": "array",
      "items": { "type": "string" },
      "description": "Other drill ids a learner should have some mastery of first (used for map ordering, not enforced)"
    }
  }
}
